{
  "$schema": "http://json-schema.org/draft-07/schema#",
  "title": "signals agent-mode output envelope",
  "description": "Stable agent-mode JSON envelope produced by `signals --json`. All envelopes share the same top-level shape across the four RTLScanner tools.",
  "type": "object",
  "required": [
    "tool",
    "version",
    "status",
    "command",
    "data",
    "diagnostics",
    "errors",
    "summary"
  ],
  "properties": {
    "tool": {
      "type": "string",
      "const": "signals"
    },
    "version": {
      "type": "string"
    },
    "status": {
      "type": "string",
      "enum": [
        "ok",
        "error"
      ]
    },
    "command": {
      "type": "object",
      "description": "Echo of the parsed argparse Namespace minus output flags."
    },
    "data": {
      "oneOf": [
        {
          "type": "object",
          "required": [
            "mode",
            "scope",
            "signals"
          ],
          "properties": {
            "mode": {
              "type": "string",
              "const": "list"
            },
            "scope": {
              "type": "string"
            },
            "signals": {
              "type": "array",
              "items": {
                "type": "object",
                "required": [
                  "name"
                ],
                "properties": {
                  "name": {
                    "type": "string"
                  },
                  "type": {
                    "type": "string"
                  },
                  "kind": {
                    "type": "string"
                  }
                },
                "additionalProperties": true
              }
            }
          }
        },
        {
          "type": "null"
        }
      ]
    },
    "diagnostics": {
      "type": "array",
      "items": {
        "type": "object",
        "required": [
          "severity",
          "file",
          "line",
          "col",
          "message"
        ],
        "properties": {
          "severity": {
            "type": "string",
            "enum": [
              "error",
              "warning",
              "note",
              "info"
            ]
          },
          "file": {
            "type": "string"
          },
          "line": {
            "type": "integer",
            "minimum": 0
          },
          "col": {
            "type": "integer",
            "minimum": 0
          },
          "message": {
            "type": "string"
          }
        },
        "additionalProperties": false
      }
    },
    "errors": {
      "type": "array",
      "items": {
        "type": "object",
        "required": [
          "code",
          "message"
        ],
        "properties": {
          "code": {
            "type": "string",
            "enum": [
              "INPUT_NOT_FOUND",
              "BAD_FILELIST",
              "COMPILE_FAILED",
              "SCOPE_NOT_FOUND",
              "SIGNAL_NOT_FOUND",
              "BAD_CONFIG",
              "NO_TOP",
              "INTERNAL_ERROR"
            ]
          },
          "message": {
            "type": "string"
          }
        },
        "additionalProperties": false
      }
    },
    "summary": {
      "oneOf": [
        {
          "type": "object",
          "required": [
            "mode",
            "signals"
          ],
          "properties": {
            "mode": {
              "type": "string"
            },
            "signals": {
              "type": "integer"
            }
          }
        },
        {
          "type": "null"
        }
      ]
    }
  },
  "additionalProperties": false
}
